{
  "schemaVersion": "1.0.0",
  "kind": "municipality-audit",
  "municipality": {
    "code": "GM0202",
    "name": "Arnhem",
    "province": "Gelderland",
    "safetyRegion": "Gelderland-Midden"
  },
  "agent": {
    "taskName": "municipality_gm0202",
    "agentId": "/root/causal_engine_v3",
    "completedAt": "2026-09-02T14:02:41Z"
  },
  "verdict": "correction-required",
  "executiveSummary": "GM0202 passes the complete deterministic contract over ten canonical scenarios, T+0/6/12/24/48/72 and all eight services; official identity, 2025 boundary, headline CBS statistics, null semantics, settlements, routes, arithmetic, causal ledgers and recovery guards are coherent. Release is nevertheless correction-required because two reproducible spatial defects affect Arnhem directly. First, neighbourhood hazard severity is municipality severity multiplied by a deterministic hash, so the river case ranks elevated Arnhem-Noord neighbourhoods among the most exposed while some low southern areas rank near the bottom, contrary to the municipality's documented stuwwal, floodplain and hydraulic compartments. Second, the canonical wildfire's modeled 18 km T+24 flame footprint intersects GM0202's official polygon and northern nature area, but a centre-point-only test reports exactly zero direct flame because Arnhem's label point is 23.151 km from the epicentre although an official boundary vertex is 15.828 km away. River and pluvial forcing are locally relevant and the completed 2026 Rijnkade is real, but current amplitudes, affected-person allocations and first-72-hour service trajectories are planning proxies, not LIWO depth/arrival, WRIJ stress-test, operator-outage or restoration predictions. All eight utility views correctly disclose NWB corridors as logical transfer proxies; unavailable or security-sensitive topology, live asset state, crews, backups and inventories were not invented.",
  "evidenceSources": [
    {
      "publisher": "Centraal Bureau voor de Statistiek",
      "title": "Kerncijfers wijken en buurten 2025 — filtered municipality row GM0202",
      "url": "https://opendata.cbs.nl/ODataApi/OData/86165NED/TypedDataSet?%24filter=WijkenEnBuurten%20eq%20%27GM0202%20%20%20%20%27&%24select=WijkenEnBuurten%2CGemeentenaam_1%2CAantalInwoners_5%2CBevolkingsdichtheid_34%2Ck_65JaarOfOuder_12%2CEenpersoonshuishoudens_30",
      "accessedAt": "2026-09-02T13:54:15Z",
      "edition": 2025,
      "supports": [
        "Official GM0202 identity and population 169,364.",
        "Official density 1,733 per square kilometre, age-65-plus count 27,866 and one-person-household count 41,787.",
        "Reference totals for checking the generated municipality and rounded neighbourhood statistics."
      ]
    },
    {
      "publisher": "PDOK / Centraal Bureau voor de Statistiek",
      "title": "Gemeente gegeneraliseerd 2025",
      "url": "https://api.pdok.nl/cbs/gebiedsindelingen/ogc/v1/collections/gemeente_gegeneraliseerd/items?f=json&limit=1000&datetime=2025-07-01T00%3A00%3A00Z",
      "accessedAt": "2026-09-02T13:54:15Z",
      "edition": 2025,
      "supports": [
        "Official generalized GM0202 administrative geometry consumed by the application.",
        "Boundary, municipality-centre and point-in-polygon checks; CBS neighbourhood, BAG woonplaats and BRT settlement products retain separate provenance.",
        "The geometry used to reproduce the canonical wildfire footprint intersection."
      ]
    },
    {
      "publisher": "Gemeente Arnhem",
      "title": "Strategie Klimaatadaptatie Arnhem",
      "url": "https://www.arnhem.nl/alle-onderwerpen/klimaat-en-vergroenen/strategie-klimaatadaptatie-arnhem/",
      "accessedAt": "2026-09-02T13:54:15Z",
      "edition": 2026,
      "supports": [
        "Arnhem identifies flooding, intense-rain water nuisance, heat and drought as local safety, health and economic risks.",
        "The local rain strategy retains water in upper slope source areas and routes it to parks and green buffers; a water-overload map and heat-attention map identify priority locations.",
        "The Rhine's high-water regime and adjustment of dikes and quays along the Nederrijn and IJssel are explicit local context."
      ]
    },
    {
      "publisher": "Veiligheids- en Gezondheidsregio Gelderland-Midden",
      "title": "Risicoprofielen",
      "url": "https://vggm.nl/risicoprofielen",
      "accessedAt": "2026-09-02T13:54:15Z",
      "edition": 2026,
      "supports": [
        "Flooding and epidemic/pandemic are identified as the largest regional risks, followed by nature fire, cybercrime, utility disruption and animal disease.",
        "VGGM's risk approach is spatial and building-aware; it distinguishes source/effect areas, estimated presence and vulnerable objects rather than using a municipality label point alone.",
        "Regional relevance does not validate the simulator's scenario amplitudes, footprints or operational response resources."
      ]
    },
    {
      "publisher": "Gemeente Arnhem",
      "title": "Stadsblokken – Meinerswijk 2015, adopted spatial-plan explanation",
      "url": "https://open.arnhem.nl/ruimtelijkeplannen/plannen/NL.IMRO.0202.754-/NL.IMRO.0202.754-0301/t_NL.IMRO.0202.754-0301.html",
      "accessedAt": "2026-09-02T13:54:15Z",
      "edition": "adopted 2015",
      "supports": [
        "Meinerswijk is an approximately 250-hectare outer-dike floodplain and the Green River fills at high water; the area is part of the Nederrijn conveyance regime.",
        "Arnhem-Noord is built high on the push moraine, in explicit contrast with the river landscape and defended southern compartments.",
        "Local river exposure therefore requires terrain, dike/outer-dike status and connected hydraulic geometry rather than deterministic neighbourhood hashes."
      ]
    },
    {
      "publisher": "Waterschap Rijn en IJssel",
      "title": "Versterken Rijnkade Arnhem",
      "url": "https://www.wrij.nl/projecten/versterken-rijnkade-arnhem",
      "accessedAt": "2026-09-02T13:54:15Z",
      "edition": "project completed 2026-05",
      "supports": [
        "The Rijnkade is a high-water defence and more than one kilometre was strengthened because part did not meet future extreme-high-water requirements.",
        "The strengthened quay opened in May 2026; scenario calibration must preserve a dated defence state rather than silently treating all city fabric alike.",
        "Completion does not establish an all-clear for an unspecified breach or extreme event."
      ]
    },
    {
      "publisher": "Waterschap Rijn en IJssel",
      "title": "Klimaateffectatlas KEA_DATA ArcGIS MapServer",
      "url": "https://opengeo.wrij.nl/arcgis/rest/services/Klimaat/KEA_DATA/MapServer",
      "accessedAt": "2026-09-02T13:54:15Z",
      "edition": "live service inspected 2026-09-02",
      "supports": [
        "Machine-readable Arnhem layers include water-overload water polygons (155), water-on-street lines (156), reports (157), measures (178) and attention-map polygons/lines (179/180).",
        "The official service supports REST queries and GeoJSON output and is materially more local than a hash-based neighbourhood rank.",
        "The service publishes blank copyright text and no update cadence, so reuse rights and freshness must be confirmed before redistribution."
      ]
    },
    {
      "publisher": "Gemeente Arnhem",
      "title": "Natuurbeheer bossen en parken",
      "url": "https://www.arnhem.nl/alle-onderwerpen/groenbeheer/natuurbeheer-bossen-en-parken/",
      "accessedAt": "2026-09-02T13:54:15Z",
      "edition": 2026,
      "supports": [
        "Arnhem manages more than 2,500 hectares of nature in forests, heath, agricultural nature, floodplains and polder parks.",
        "Forest, heath and nature north of the Schelmseweg form part of Natura 2000 Veluwe, and local management explicitly addresses forest-fire origin and spread.",
        "The northern municipal polygon intersected by the canonical T+24 fire circle cannot be dismissed solely because the municipality label point lies outside that circle."
      ]
    }
  ],
  "dataChecks": {
    "identity": {
      "status": "pass",
      "summary": "GM0202, Arnhem, Gelderland and safety region Gelderland-Midden are internally and officially coherent.",
      "evidenceRefs": ["E01", "E02", "E04"],
      "notes": [
        "The generated feature id, municipality bundle code and name equal GM0202/Arnhem.",
        "The generated safety-region overlay contains GM0202 in exactly one region, Gelderland-Midden.",
        "A current Kadaster bestuurlijke-gebieden query independently returned identification GM0202, name Arnhem and province Gelderland."
      ]
    },
    "geography": {
      "status": "pass",
      "summary": "The consumed 2025 generalized municipality geometry and centre are coherent, while distinct source products remain explicit.",
      "evidenceRefs": ["E02", "E05"],
      "notes": [
        "Generated centre [5.8967587163818145, 51.99233730896442] is inside the official generalized municipality geometry.",
        "BoundaryEdition and statisticsEdition both equal 2025; newer definitive Kadaster geometry was used only as an identity cross-check.",
        "BAG woonplaats, BRT settlement and CBS municipality/neighbourhood geometries represent different objects and must not be forced to share edges or totals.",
        "The official municipality includes both Nederrijn floodplain/southern compartments and the elevated Arnhem-Noord moraine, a distinction lost by municipality-wide scalar allocation."
      ]
    },
    "demography": {
      "status": "pass",
      "summary": "Headline municipality statistics match CBS 2025 and rounded neighbourhood population reconciles within publication precision.",
      "evidenceRefs": ["E01"],
      "notes": [
        "Generated population 169,364, density 1,733 and one-person-household count 41,787 exactly match the filtered CBS municipality row.",